{
  "baseResearchInputManifest": {
    "path": "research/2026-08-12/research_input_manifest.json",
    "sha256": "6c1fecfe8b1cf1a716d689237331f2185b9fcc9ca371cf4577f66b7c60e64ae7"
  },
  "contractVersion": "1.0.0",
  "episodeDate": "2026-08-12",
  "waves": [
    {
      "collectorRunId": 31609888153,
      "evidenceFiles": [
        {
          "path": "research/2026-08-12/evidence/RA-NVDA-0811-1M_intraday_series.json",
          "requestId": "RA-NVDA-0811-1M",
          "sha256": "80822c79c556fa89229774e6d1352bda5d973bde73709097e64d5da3be7368b4"
        },
        {
          "path": "research/2026-08-12/evidence/RA-SOXX-0811-1M_intraday_series.json",
          "requestId": "RA-SOXX-0811-1M",
          "sha256": "729a18067d9e6b6fc6ce9de55b17e9ab79c609a587d05cb0c8753bd6ed5c1b5a"
        },
        {
          "path": "research/2026-08-12/evidence/RA-AP-CLOSE_exact_url_archive.json",
          "requestId": "RA-AP-CLOSE",
          "sha256": "6e7bdbcf5b9b3a0dde7aad850dc4e2fde8d059585a712121837b7f5b53ef0c55"
        }
      ],
      "request": {
        "path": "research/2026-08-12/acquisition/wave-01/research_acquisition_request.json",
        "sha256": "5ce93b20bfea5282e7e46ce6886bbd3b3d4f5b93a95ee86833747cf99afcf670"
      },
      "result": {
        "path": "research/2026-08-12/acquisition/wave-01/research_acquisition_result.json",
        "sha256": "1581e5c03e0ae68ae68e5dcad83f611c6384d02c683bff58f1ee6e01327524bf"
      },
      "wave": 1
    }
  ]
}
